{
  "alert": {
    "alert_id": "alt_001",
    "machine_id": "M-001",
    "severity": "CRITICAL",
    "status": "OPEN",
    "risk_score": 0.91,
    "policy_version": "risk-policy-1.0.0"
  },
  "prediction": {
    "prediction_id": "pred_001",
    "prediction": "FAILURE",
    "failure_probability": 0.91,
    "model_version": "maintai-ml-1.0.0"
  },
  "sensor_context": {
    "product_type": "M",
    "air_temperature_k": 298.1,
    "process_temperature_k": 308.6,
    "rotational_speed_rpm": 1551,
    "torque_nm": 42.8,
    "tool_wear_min": 108
  },
  "intent": "TECHNICIAN_CHECKLIST"
}
